{
  "event_type": "artifact_bundle.available",
  "event_version": 1,
  "event_id": "evt_hqrp1222qsfd22ze232yxsn9kt",
  "occurred_at": "2026-03-29T09:30:06Z",
  "producer": "platform-control",
  "correlation_id": "run_e5kck8ng5brv64m5r4hrwez0nf",
  "payload": {
    "bundle_manifest_id": "abm_5kqhdrcka34ykyng7rew7cbgqs",
    "source_snapshot_id": "snap_8bhjbrx3bshme9dhnkd7rze7h8",
    "provenance": {
      "tenant_id": "tenant_public",
      "corpus_id": "corpus_public_ch_fedlex_constitution",
      "scope_type": "global_public",
      "source_id": "src_s5jrtxrfrrr16ynwjm2p6mhkkt",
      "source_version_id": "sv_54fzg157tp62j6fahmn4skqsf0",
      "run_id": "run_e5kck8ng5brv64m5r4hrwez0nf",
      "source_snapshot_id": "snap_8bhjbrx3bshme9dhnkd7rze7h8",
      "bundle_manifest_id": "abm_5kqhdrcka34ykyng7rew7cbgqs"
    },
    "source_origin_kind": "official_primary",
    "trust_tier": "authoritative",
    "bundle_manifest_ref": {
      "manifest_id": "abm_5kqhdrcka34ykyng7rew7cbgqs",
      "manifest_type": "artifact_bundle_manifest",
      "manifest_version": 1,
      "storage_ref": {
        "uri": "file://__MANIFEST_PATH__",
        "content_type": "application/json",
        "byte_size": "__MANIFEST_SIZE__",
        "checksum": "__MANIFEST_CHECKSUM__",
        "checksum_algorithm": "sha256",
        "created_at": "2026-03-29T09:30:05Z"
      }
    }
  }
}
