{
  "event_type": "document.withdrawn",
  "event_version": 1,
  "event_id": "evt_01jq7cbnn3pmrm7e6s8yq8rf5h",
  "occurred_at": "2026-03-29T10:11:00Z",
  "producer": "document-intelligence",
  "correlation_id": "run_01jq7a3s9b7j4dndd9sgv6pb9d",
  "payload": {
    "document_id": "doc_01jq7bdptzqv3xs0c41xpw1ybg",
    "document_revision": 4,
    "processing_manifest_id": "pm_01jq7cacd0zdw8r9nm7j7n6cnp",
    "provenance": {
      "tenant_id": "tenant_public",
      "corpus_id": "corpus_public_ch_federal_law",
      "scope_type": "global_public",
      "source_id": "src_01jq79xv3wdd6yr8q5bn0m3zfk",
      "source_version_id": "sv_01jq79zcskf4m3m4gm3t5s59xq",
      "run_id": "run_01jq7a3s9b7j4dndd9sgv6pb9d",
      "source_snapshot_id": "snap_01jq7a7n3nbzj6sk7v95p9frz1",
      "bundle_manifest_id": "abm_01jq7ab8x4nm7m3qz3b8e9q2fk",
      "artifact_id": "art_01jq7af3f8qqc46zc6xvkf9y4x",
      "document_id": "doc_01jq7bdptzqv3xs0c41xpw1ybg",
      "document_revision": 4,
      "processing_manifest_id": "pm_01jq7cacd0zdw8r9nm7j7n6cnp"
    },
    "reason_code": "operator_withdrawn",
    "reason_summary": "Operator marked this ingest as a duplicate of a different canonical document.",
    "search_disposition": "remove"
  }
}
