{
  "event_type": "artifact_bundle.available",
  "event_version": 1,
  "event_id": "evt_5tzmq8wr3kbn7vxc2hjd9pfa6y",
  "occurred_at": "2026-03-29T09:30:06Z",
  "producer": "platform-control",
  "correlation_id": "run_01kxe7gbdd9st8m6k9vvh46n49",
  "payload": {
    "bundle_manifest_id": "abm_2v7pr9wx4qk1m3snbd6thzey8c",
    "source_snapshot_id": "snap_3kqm7wvz9r2ne5td8bhx1yfa4g",
    "provenance": {
      "tenant_id": "tenant_public",
      "corpus_id": "corpus_public_ch_fedlex_constitution",
      "scope_type": "global_public",
      "source_id": "src_9dqzk4mtv7rn2xewb3hy6spa1c",
      "source_version_id": "sv_7htyq2vmc4br9xkn8zwde5fp3s",
      "run_id": "run_01kxe7gbdd9st8m6k9vvh46n49",
      "source_snapshot_id": "snap_3kqm7wvz9r2ne5td8bhx1yfa4g",
      "bundle_manifest_id": "abm_2v7pr9wx4qk1m3snbd6thzey8c"
    },
    "source_origin_kind": "official_primary",
    "trust_tier": "authoritative",
    "bundle_manifest_ref": {
      "manifest_id": "abm_2v7pr9wx4qk1m3snbd6thzey8c",
      "manifest_type": "artifact_bundle_manifest",
      "manifest_version": 1,
      "storage_ref": {
        "uri": "file://__MANIFEST_PATH__",
        "content_type": "application/json",
        "byte_size": "__MANIFEST_SIZE__",
        "checksum": "__MANIFEST_CHECKSUM__",
        "checksum_algorithm": "sha256",
        "created_at": "2026-03-29T09:30:05Z"
      }
    }
  }
}
